[
  {
    "field_name": "audio_prep_1",
    "form_name": "audio",
    "section_header": "Preparación de la tarea de voz",
    "field_type": "info",
    "field_label": "",
    "select_choices_or_calculations": [
      {
        "label": "En las dos tareas siguientes, tendrá que grabarse a usted mismo hablando. Para hacerlo, encuentre un lugar tranquilo y silencioso y póngase cómodo.",
        "code": "Primer paso"
      },
      {
        "label": "Mientras se graba, puede estar sentado o de pie. En ambas tareas, hable de forma natural. No intente cambiar su tono de voz o la velocidad de su habla habitual.",
        "code": "Segundo paso"
      },
      {
        "label": "En el caso de que la grabación sea interrumpida por la razón que sea, tendrá otra oportunidad para volverla a repetir.",
        "code": "Tercer paso"
      }
    ],
    "field_note": "",
    "text_validation_type_or_show_slider_number": "",
    "text_validation_min": "",
    "text_validation_max": "",
    "identifier": "",
    "branching_logic": "",
    "required_field": "",
    "custom_alignment": "",
    "question_number": "",
    "matrix_group_name": "audio",
    "matrix_ranking": "",
    "field_annotation": "",
    "evaluated_logic": ""
  },
  {
    "field_name": "audio_prep_2",
    "form_name": "audio",
    "section_header": "Empecemos.",
    "field_type": "info",
    "field_label": "Los siguientes tres pasos nos aseguraran que la calidad de la grabación sea buena.",
    "select_choices_or_calculations": [
      {
        "label": "Durante la grabación, aguante el teléfono firmemente y delante suyo, como si estuviera haciendo una video llamada con Skype, Whatsapp o Facetime por ejemplo.",
        "code": "Primer paso"
      },
      {
        "label": "Su brazo tendrá que estar doblado de una forma natural y relajada. Intente evitar estirar el brazo completamente o poner el teléfono demasiado cerca de su cara.",
        "code": "Segundo paso"
      },
      {
        "label": "Asegúrese que el micrófono del teléfono no esté cubierto por su mano o por cualquier otro objeto.",
        "code": "Tercer paso"
      }
    ],
    "field_note": "",
    "text_validation_type_or_show_slider_number": "",
    "text_validation_min": "",
    "text_validation_max": "",
    "identifier": "",
    "branching_logic": "",
    "required_field": "",
    "custom_alignment": "",
    "question_number": "",
    "matrix_group_name": "audio",
    "matrix_ranking": "",
    "field_annotation": "",
    "evaluated_logic": ""
  },
  {
    "field_name": "audio_prep_3",
    "form_name": "audio",
    "section_header": "Empecemos.",
    "field_type": "info",
    "field_label": "",
    "select_choices_or_calculations": [
      {
        "label": "Por favor, asegúrese de que puede completar esta tarea. A partir de esta pregunta, no podrá retroceder ni reiniciar. Si está listo, presione 'Siguiente' para continuar.",
        "code": "Importante"
      }
    ],
    "field_note": "",
    "text_validation_type_or_show_slider_number": "",
    "text_validation_min": "",
    "text_validation_max": "",
    "identifier": "",
    "branching_logic": "",
    "required_field": "",
    "custom_alignment": "",
    "question_number": "",
    "matrix_group_name": "audio",
    "matrix_ranking": "",
    "field_annotation": "",
    "evaluated_logic": ""
  },
  {
    "field_name": "audio_scripted_4",
    "form_name": "audio",
    "section_header": "Aquí debajo hay el texto de “el Viento del Norte y el Sol”, una de las fábulas de Esopo. Apriete “Inicio”, lea el texto en voz alta y, cuando haya acabado de leer el texto, apriete “Detener”.",
    "field_type": "audio",
    "field_label": "\"El viento norte y el sol porfiaban sobre cuál de ellos era el más fuerte, cuando acertó a pasar un viajero envuelto en ancha capa.  Convinieron en que quien antes lograra obligar al viajero a quitarse la capa sería considerado más poderoso. El viento norte sopló con gran furia, pero cuanto más soplaba, más se arrebujaba en su capa el viajero; por fin el viento norte abandonó la empresa. Entonces brilló el sol con ardor, e inmediatamente se despojó de su capa el viajero. Por lo que el viento norte hubo de reconocer la superioridad del sol.\"",
    "select_choices_or_calculations": [],
    "field_note": "",
    "text_validation_type_or_show_slider_number": "",
    "text_validation_min": "",
    "text_validation_max": "",
    "identifier": "",
    "branching_logic": "",
    "required_field": "",
    "custom_alignment": "",
    "question_number": "",
    "matrix_group_name": "audio",
    "matrix_ranking": "",
    "field_annotation": "",
    "evaluated_logic": ""
  },
  {
    "field_name": "audio_unscripted",
    "form_name": "audio",
    "section_header": "Ahora tendrá que grabarse respondiendo a una pregunta. Puede contestar la pregunta de la manera que quiera. Si prefiere no realizar la tarea, pulse “Finalizar”. Esta grabación no puede ser utilizada para enviar mensajes al equipo de investigación del estudio RADAR. Si necesita ayuda, no dude en contactar con su equipo de referencia.",
    "field_type": "audio",
    "field_label": "Explíquenos alguna cosa que vaya a ocurrir la semana siguiente que esté esperando con ganas.",
    "select_choices_or_calculations": [],
    "field_note": "",
    "text_validation_type_or_show_slider_number": "",
    "text_validation_min": "",
    "text_validation_max": "",
    "identifier": "",
    "branching_logic": "",
    "required_field": "",
    "custom_alignment": "",
    "question_number": "",
    "matrix_group_name": "audio",
    "matrix_ranking": "",
    "field_annotation": "",
    "evaluated_logic": ""
  }
]
