[
    {
        "field_name": "phq_8_1",
        "form_name": "maam_phq8",
        "section_header": "Today, how much have you been bothered by any of the following problems?",
        "field_type": "radio",
        "field_label": "Little interest or pleasure in doing things",
        "select_choices_or_calculations": [
            {
                "code": "1",
                "label": "Not at all"
            },
            {
                "code": "2",
                "label": "A little bit"
            },
            {
                "code": "3",
                "label": "Moderately"
            },
            {
                "code": "4",
                "label": "Quite a bit"
            },
            {
                "code": "5",
                "label": "Extremely"
            }
        ],
        "field_note": "",
        "text_validation_type_or_show_slider_number": "",
        "text_validation_min": "",
        "text_validation_max": "",
        "identifier": "",
        "branching_logic": "",
        "required_field": "y",
        "custom_alignment": "",
        "question_number": "",
        "matrix_group_name": "phq_8",
        "matrix_ranking": "",
        "field_annotation": "",
        "evaluated_logic": ""
    },
    {
        "field_name": "phq_8_2",
        "form_name": "maam_phq8",
        "section_header": "",
        "field_type": "radio",
        "field_label": "Feeling down, depressed, or hopeless",
        "select_choices_or_calculations": [
            {
                "code": "1",
                "label": "Not at all"
            },
            {
                "code": "2",
                "label": "A little bit"
            },
            {
                "code": "3",
                "label": "Moderately"
            },
            {
                "code": "4",
                "label": "Quite a bit"
            },
            {
                "code": "5",
                "label": "Extremely"
            }
        ],
        "field_note": "",
        "text_validation_type_or_show_slider_number": "",
        "text_validation_min": "",
        "text_validation_max": "",
        "identifier": "",
        "branching_logic": "",
        "required_field": "y",
        "custom_alignment": "",
        "question_number": "",
        "matrix_group_name": "phq_8",
        "matrix_ranking": "",
        "field_annotation": "",
        "evaluated_logic": ""
    }
]