[
    {
        "field_name": "swqpr_date",
        "form_name": "proxy_six_weekly_questionnaire",
        "section_header": "",
        "field_type": "text",
        "field_label": "Date completed",
        "select_choices_or_calculations": [],
        "field_note": "",
        "text_validation_type_or_show_slider_number": "date_dmy",
        "text_validation_min": "[screening_arm_1][sf_date]",
        "text_validation_max": "today",
        "identifier": "",
        "branching_logic": "",
        "required_field": "",
        "custom_alignment": "",
        "question_number": "",
        "matrix_group_name": "",
        "matrix_ranking": "",
        "field_annotation": "",
        "evaluated_logic": ""
    },
    {
        "field_name": "swqpr_header",
        "form_name": "proxy_six_weekly_questionnaire",
        "section_header": "",
        "field_type": "descriptive",
        "field_label": "<div class=\"rich-text-field-label\"><table border=\"\" width=\"100%\" cellpadding=\"15\" bgcolor=\"#F1948A\"> <tbody> <tr> <td style=\"border-style: solid; border-width: 1px;\"><center> <h5><br><strong>This form should be completed in SURVEY mode. <br><br>Please <a style=\"font-size: large;\" href=\"[survey-url:proxy_six_weekly_questionnaire]\"><strong>CLICK HERE</strong></a> to begin,<br><br></strong><strong>and then click the <span style=\"color: #800000;\">Leave without saving changes</span> button to proceed.</strong></h5> <p> </p> </center></td> </tr> </tbody> </table></div>",
        "select_choices_or_calculations": [],
        "field_note": "",
        "text_validation_type_or_show_slider_number": "",
        "text_validation_min": "",
        "text_validation_max": "",
        "identifier": "",
        "branching_logic": "",
        "required_field": "",
        "custom_alignment": "",
        "question_number": "",
        "matrix_group_name": "",
        "matrix_ranking": "",
        "field_annotation": "",
        "evaluated_logic": ""
    },
    {
        "field_name": "swqpr_instruction",
        "form_name": "proxy_six_weekly_questionnaire",
        "section_header": "",
        "field_type": "descriptive",
        "field_label": "Please answer the following questions about the person who you are acting as a proxy for in the RECURRENT-GB study.",
        "select_choices_or_calculations": [],
        "field_note": "",
        "text_validation_type_or_show_slider_number": "",
        "text_validation_min": "",
        "text_validation_max": "",
        "identifier": "",
        "branching_logic": "",
        "required_field": "",
        "custom_alignment": "",
        "question_number": "",
        "matrix_group_name": "",
        "matrix_ranking": "",
        "field_annotation": "",
        "evaluated_logic": ""
    },
    {
        "field_name": "swqpr_who_performance",
        "form_name": "proxy_six_weekly_questionnaire",
        "section_header": "",
        "field_type": "radio",
        "field_label": "Which of the below numbers do you think best describes them at the moment:",
        "select_choices_or_calculations": [
            {
                "code": "0",
                "label": "Fully active (Able to carry on all pre-disease performance without restriction)"
            },
            {
                "code": "1",
                "label": "Restricted in physically strenuous activity but they can walk and are able to carry out work of a light or sedentary nature (e.g. light housework or office work)"
            },
            {
                "code": "2",
                "label": "Able to get around and capable of self-care but unable to carry out any work activities; up and about more than 50% of their waking hours"
            },
            {
                "code": "3",
                "label": "Capable of only limited self-care, confined to a bed or chair more than 50% of their waking hours"
            },
            {
                "code": "4",
                "label": "Completely disabled. Cannot carry out any self-care. Totally confined to a bed or chair."
            }
        ],
        "field_note": "",
        "text_validation_type_or_show_slider_number": "",
        "text_validation_min": "",
        "text_validation_max": "",
        "identifier": "",
        "branching_logic": "",
        "required_field": "",
        "custom_alignment": "",
        "question_number": "",
        "matrix_group_name": "",
        "matrix_ranking": "",
        "field_annotation": "",
        "evaluated_logic": ""
    }
]