[
    {
        "field_name": "do_you_feel_your_state_has",
        "form_name": "ers",
        "section_header": "",
        "field_type": "range",
        "field_label": "How have your COPD symptoms changed in recent days?",
        "select_choices_or_calculations": [
            {
                "code": "0",
                "label": "0 Worsened"
            },
            {
                "code": "1",
                "label": "1"
            },
            {
                "code": "2",
                "label": "2"
            },
            {
                "code": "3",
                "label": "3 No change"
            },
            {
                "code": "4",
                "label": "4"
            },
            {
                "code": "5",
                "label": "5"
            },
            {
                "code": "6",
                "label": "6 Improved"
            }
        ],
        "field_note": "",
        "text_validation_type_or_show_slider_number": "",
        "text_validation_min": "",
        "text_validation_max": "",
        "identifier": "",
        "branching_logic": "",
        "required_field": "y",
        "custom_alignment": "",
        "question_number": "",
        "matrix_group_name": "",
        "matrix_ranking": "",
        "field_annotation": "range-type",
        "evaluated_logic": ""
    },
    {
        "field_name": "how_likely_do_you_feel_it",
        "form_name": "ers",
        "section_header": "",
        "field_type": "range",
        "field_label": "How likely do you feel it is that you have a chest infection / acute exacerbations based on increasing symptoms and/ or sputum production?",
        "select_choices_or_calculations": [
            {
                "code": "0",
                "label": "None"
            },
            {
                "code": "1",
                "label": "1"
            },
            {
                "code": "2",
                "label": "2"
            },
            {
                "code": "3",
                "label": "3"
            },
            {
                "code": "4",
                "label": "4"
            },
            {
                "code": "5",
                "label": "Very Likely"
            }
        ],
        "field_note": "",
        "text_validation_type_or_show_slider_number": "",
        "text_validation_min": "",
        "text_validation_max": "",
        "identifier": "",
        "branching_logic": "[do_you_feel_your_state_has] = 0 or [do_you_feel_your_state_has] = 1 or [do_you_feel_your_state_has] = 2 or [do_you_feel_your_state_has] = 3 or [do_you_feel_your_state_has] = 4 or [do_you_feel_your_state_has] = 5",
        "required_field": "y",
        "custom_alignment": "",
        "question_number": "",
        "matrix_group_name": "",
        "matrix_ranking": "",
        "field_annotation": "range-type",
        "evaluated_logic": "responses['do_you_feel_your_state_has'] ==  0 || responses['do_you_feel_your_state_has'] ==  1 || responses['do_you_feel_your_state_has'] ==  2 || responses['do_you_feel_your_state_has'] ==  3 || responses['do_you_feel_your_state_has'] ==  4 || responses['do_you_feel_your_state_has'] ==  5"
    },
    {
        "field_name": "please_select_the_ones_tha",
        "form_name": "ers",
        "section_header": "",
        "field_type": "checkbox",
        "field_label": "Are you taking any medications for exacerbation today? Please select all the ones that apply:",
        "select_choices_or_calculations": [
            {
                "code": "0",
                "label": "None"
            },
            {
                "code": "1",
                "label": "Steroids"
            },
            {
                "code": "2",
                "label": "Antibiotics"
            }
        ],
        "field_note": "",
        "text_validation_type_or_show_slider_number": "",
        "text_validation_min": "",
        "text_validation_max": "",
        "identifier": "",
        "branching_logic": "",
        "required_field": "",
        "custom_alignment": "",
        "question_number": "",
        "matrix_group_name": "",
        "matrix_ranking": "",
        "field_annotation": "",
        "evaluated_logic": ""
    }
]