[
  {
    "field_name": "pn_prep_1",
    "form_name": "picture_naming",
    "section_header": "Picture Naming Task",
    "field_type": "info",
    "field_label": "In this task you will be shown a picture of an object. Please say the name of the object out loud.",
    "select_choices_or_calculations": [
      {
        "code": "Instructions",
        "label": "Look at each picture and say what it is as quickly as you can. You will have up to 15 seconds for each item."
      },
      {
        "code": "Format",
        "label": "There are 6 pictures in total, shown one at a time. The instruction will be read aloud when each picture appears."
      },
      {
        "code": "Note",
        "label": "If you are unable to speak right now, you will have the option to indicate this on each screen."
      }
    ],
    "field_note": "",
    "text_validation_type_or_show_slider_number": "",
    "text_validation_min": "",
    "text_validation_max": "",
    "identifier": "",
    "branching_logic": "",
    "required_field": "",
    "custom_alignment": "",
    "question_number": "",
    "matrix_group_name": "pn",
    "matrix_ranking": "",
    "field_annotation": "",
    "evaluated_logic": ""
  },
  {
    "field_name": "pn_prep_2",
    "form_name": "picture_naming",
    "section_header": "Ready to begin",
    "field_type": "info",
    "field_label": "",
    "select_choices_or_calculations": [
      {
        "code": "Important",
        "label": "From the next screen onwards you will not be able to go back. Make sure you are in a quiet place and are ready to respond. Press Next to begin."
      }
    ],
    "field_note": "",
    "text_validation_type_or_show_slider_number": "",
    "text_validation_min": "",
    "text_validation_max": "",
    "identifier": "",
    "branching_logic": "",
    "required_field": "",
    "custom_alignment": "",
    "question_number": "",
    "matrix_group_name": "pn",
    "matrix_ranking": "",
    "field_annotation": "",
    "evaluated_logic": ""
  },
  {
    "field_name": "pn_item_1",
    "form_name": "picture_naming",
    "section_header": "Picture 1 of 6",
    "field_type": "guided-audio",
    "field_label": "What is this?",
    "select_choices_or_calculations": [],
    "field_note": "",
    "text_validation_type_or_show_slider_number": "",
    "text_validation_min": "",
    "text_validation_max": "",
    "identifier": "",
    "branching_logic": "",
    "required_field": "",
    "custom_alignment": "",
    "question_number": "1",
    "matrix_group_name": "pn",
    "matrix_ranking": "",
    "field_annotation": {
      "auto_tts": true,
      "auto_record_after_tts": true,
      "record_seconds": 15,
      "allow_replay_prompt": false,
      "unable_to_speak_option": true,
      "image": "https://raw.githubusercontent.com/RADAR-base/RADAR-REDCap-aRMT-Definitions/f04834f6c1f7d21cbac90653650129b337450eb6/questionnaires/recurrent_picture_naming/dog.png"
    },
    "evaluated_logic": ""
  },
  {
    "field_name": "pn_item_2",
    "form_name": "picture_naming",
    "section_header": "Picture 2 of 6",
    "field_type": "guided-audio",
    "field_label": "What is this?",
    "select_choices_or_calculations": [],
    "field_note": "",
    "text_validation_type_or_show_slider_number": "",
    "text_validation_min": "",
    "text_validation_max": "",
    "identifier": "",
    "branching_logic": "",
    "required_field": "",
    "custom_alignment": "",
    "question_number": "2",
    "matrix_group_name": "pn",
    "matrix_ranking": "",
    "field_annotation": {
      "auto_tts": true,
      "auto_record_after_tts": true,
      "record_seconds": 15,
      "allow_replay_prompt": false,
      "unable_to_speak_option": true,
      "image": "https://raw.githubusercontent.com/RADAR-base/RADAR-REDCap-aRMT-Definitions/f04834f6c1f7d21cbac90653650129b337450eb6/questionnaires/recurrent_picture_naming/escalator.png"
    },
    "evaluated_logic": ""
  },
  {
    "field_name": "pn_item_3",
    "form_name": "picture_naming",
    "section_header": "Picture 3 of 6",
    "field_type": "guided-audio",
    "field_label": "What is this?",
    "select_choices_or_calculations": [],
    "field_note": "",
    "text_validation_type_or_show_slider_number": "",
    "text_validation_min": "",
    "text_validation_max": "",
    "identifier": "",
    "branching_logic": "",
    "required_field": "",
    "custom_alignment": "",
    "question_number": "3",
    "matrix_group_name": "pn",
    "matrix_ranking": "",
    "field_annotation": {
      "auto_tts": true,
      "auto_record_after_tts": true,
      "record_seconds": 15,
      "allow_replay_prompt": false,
      "unable_to_speak_option": true,
      "image": "https://raw.githubusercontent.com/RADAR-base/RADAR-REDCap-aRMT-Definitions/f04834f6c1f7d21cbac90653650129b337450eb6/questionnaires/recurrent_picture_naming/pencil.png"
    },
    "evaluated_logic": ""
  },
  {
    "field_name": "pn_item_4",
    "form_name": "picture_naming",
    "section_header": "Picture 4 of 6",
    "field_type": "guided-audio",
    "field_label": "What is this?",
    "select_choices_or_calculations": [],
    "field_note": "",
    "text_validation_type_or_show_slider_number": "",
    "text_validation_min": "",
    "text_validation_max": "",
    "identifier": "",
    "branching_logic": "",
    "required_field": "",
    "custom_alignment": "",
    "question_number": "4",
    "matrix_group_name": "pn",
    "matrix_ranking": "",
    "field_annotation": {
      "auto_tts": true,
      "auto_record_after_tts": true,
      "record_seconds": 15,
      "allow_replay_prompt": false,
      "unable_to_speak_option": true,
      "image": "https://raw.githubusercontent.com/RADAR-base/RADAR-REDCap-aRMT-Definitions/f04834f6c1f7d21cbac90653650129b337450eb6/questionnaires/recurrent_picture_naming/octopus.png"
    },
    "evaluated_logic": ""
  },
  {
    "field_name": "pn_item_5",
    "form_name": "picture_naming",
    "section_header": "Picture 5 of 6",
    "field_type": "guided-audio",
    "field_label": "What is this?",
    "select_choices_or_calculations": [],
    "field_note": "",
    "text_validation_type_or_show_slider_number": "",
    "text_validation_min": "",
    "text_validation_max": "",
    "identifier": "",
    "branching_logic": "",
    "required_field": "",
    "custom_alignment": "",
    "question_number": "5",
    "matrix_group_name": "pn",
    "matrix_ranking": "",
    "field_annotation": {
      "auto_tts": true,
      "auto_record_after_tts": true,
      "record_seconds": 15,
      "allow_replay_prompt": false,
      "unable_to_speak_option": true,
      "image": "https://raw.githubusercontent.com/RADAR-base/RADAR-REDCap-aRMT-Definitions/f04834f6c1f7d21cbac90653650129b337450eb6/questionnaires/recurrent_picture_naming/wheelchair.png"
    },
    "evaluated_logic": ""
  },
  {
    "field_name": "pn_item_6",
    "form_name": "picture_naming",
    "section_header": "Picture 6 of 6",
    "field_type": "guided-audio",
    "field_label": "What is this?",
    "select_choices_or_calculations": [],
    "field_note": "",
    "text_validation_type_or_show_slider_number": "",
    "text_validation_min": "",
    "text_validation_max": "",
    "identifier": "",
    "branching_logic": "",
    "required_field": "",
    "custom_alignment": "",
    "question_number": "6",
    "matrix_group_name": "pn",
    "matrix_ranking": "",
    "field_annotation": {
      "auto_tts": true,
      "auto_record_after_tts": true,
      "record_seconds": 15,
      "allow_replay_prompt": false,
      "unable_to_speak_option": true,
      "image": "https://raw.githubusercontent.com/RADAR-base/RADAR-REDCap-aRMT-Definitions/f04834f6c1f7d21cbac90653650129b337450eb6/questionnaires/recurrent_picture_naming/hammock.png"
    },
    "evaluated_logic": ""
  }
]